{
  "$schema": "./schema/step.schema.json",
  "lastVerified": "2026-09-30",
  "note": "Main math track. Edit this file freely: scripts/cambridge/scrape.mjs refreshes only links, site text (siteTitle, siteTopics, stepQuestions) and verified flags, and never deletes an edit. Hints and solutions stay hidden behind the 60-minute cold timer in the UI.",
  "source": "https://step.maths.org/",
  "scrapedAt": "2026-09-30",
  "exam": {
    "durationMin": 180,
    "questions": 12,
    "sections": [
      {
        "name": "Pure",
        "count": 8
      },
      {
        "name": "Mechanics",
        "count": 2
      },
      {
        "name": "Probability and Statistics",
        "count": 2
      }
    ],
    "answerAtMost": 6,
    "bestCount": 6,
    "marksPerQuestion": 20,
    "maxMarks": 120
  },
  "phases": [
    {
      "id": "0",
      "name": "Gap check",
      "do": "Try Assignment 1 cold. If the warm-up blocks, fix only that gap: the Khan Academy topic, then the matching Underground Mathematics station.",
      "pace": {
        "text": "1-2 weeks max",
        "maxWeeks": 2
      },
      "gate": {
        "text": "Assignment 1 warm-up done unaided.",
        "xp": 200,
        "evidence": [
          {
            "key": "unaided",
            "label": "Warm-up done with no help (yes/no)",
            "type": "yesno"
          },
          {
            "key": "gaps",
            "label": "Gaps fixed on the way (topics)",
            "type": "text"
          }
        ]
      },
      "order": 0,
      "items": [],
      "uses": [
        "found-01"
      ]
    },
    {
      "id": "A",
      "name": "Foundation",
      "do": "6 blocks. For each block, do its Underground Mathematics stations first (about 1 week), then the block's assignments.",
      "pace": {
        "text": "2 assignments/week",
        "perWeek": 2,
        "unit": "assignment"
      },
      "gate": {
        "text": "Assignment 25's STEP question solved unaided in under 1 hour.",
        "xp": 200,
        "evidence": [
          {
            "key": "minutes",
            "label": "Time on the STEP question (minutes, under 60)",
            "type": "number"
          },
          {
            "key": "unaided",
            "label": "Solved with no hints (yes/no)",
            "type": "yesno"
          },
          {
            "key": "mark",
            "label": "Self-mark out of 20",
            "type": "number"
          }
        ]
      },
      "order": 1,
      "items": [
        "found-01",
        "found-02",
        "found-03",
        "found-04",
        "found-05",
        "found-06",
        "found-07",
        "found-08",
        "found-09",
        "found-10",
        "found-11",
        "found-12",
        "found-13",
        "found-14",
        "found-15",
        "found-16",
        "found-17",
        "found-18",
        "found-19",
        "found-20",
        "found-21",
        "found-22",
        "found-23",
        "found-24",
        "found-25"
      ]
    },
    {
      "id": "A+",
      "name": "Extras",
      "do": "Mixed STEP 1 sets plus Siklos problems P1 to P75, alongside Phase B.",
      "pace": {
        "text": "3/week, alongside B",
        "perWeek": 3,
        "unit": "problem"
      },
      "alongside": "B",
      "gate": null,
      "order": 2,
      "items": [
        "extra-pure",
        "extra-mechanics",
        "extra-statistics",
        "siklos-p01",
        "siklos-p02",
        "siklos-p03",
        "siklos-p04",
        "siklos-p05",
        "siklos-p06",
        "siklos-p07",
        "siklos-p08",
        "siklos-p09",
        "siklos-p10",
        "siklos-p11",
        "siklos-p12",
        "siklos-p13",
        "siklos-p14",
        "siklos-p15",
        "siklos-p16",
        "siklos-p17",
        "siklos-p18",
        "siklos-p19",
        "siklos-p20",
        "siklos-p21",
        "siklos-p22",
        "siklos-p23",
        "siklos-p24",
        "siklos-p25",
        "siklos-p26",
        "siklos-p27",
        "siklos-p28",
        "siklos-p29",
        "siklos-p30",
        "siklos-p31",
        "siklos-p32",
        "siklos-p33",
        "siklos-p34",
        "siklos-p35",
        "siklos-p36",
        "siklos-p37",
        "siklos-p38",
        "siklos-p39",
        "siklos-p40",
        "siklos-p41",
        "siklos-p42",
        "siklos-p43",
        "siklos-p44",
        "siklos-p45",
        "siklos-p46",
        "siklos-p47",
        "siklos-p48",
        "siklos-p49",
        "siklos-p50",
        "siklos-p51",
        "siklos-p52",
        "siklos-p53",
        "siklos-p54",
        "siklos-p55",
        "siklos-p56",
        "siklos-p57",
        "siklos-p58",
        "siklos-p59",
        "siklos-p60",
        "siklos-p61",
        "siklos-p62",
        "siklos-p63",
        "siklos-p64",
        "siklos-p65",
        "siklos-p66",
        "siklos-p67",
        "siklos-p68",
        "siklos-p69",
        "siklos-p70",
        "siklos-p71",
        "siklos-p72",
        "siklos-p73",
        "siklos-p74",
        "siklos-p75"
      ]
    },
    {
      "id": "B",
      "name": "STEP 2",
      "do": "10 modules in order.",
      "pace": {
        "text": "1 module/week",
        "perWeek": 1,
        "unit": "module"
      },
      "gate": {
        "text": "Timed past STEP 2 paper: 4 of 6 answered questions at 14/20 or more.",
        "xp": 200,
        "evidence": [
          {
            "key": "paper",
            "label": "Paper (year)",
            "type": "text"
          },
          {
            "key": "minutes",
            "label": "Time taken (minutes, 180 max)",
            "type": "number"
          },
          {
            "key": "marks",
            "label": "Marks for the 6 answered questions, out of 20 each",
            "type": "text"
          },
          {
            "key": "atLeast14",
            "label": "Questions at 14/20 or more (need 4)",
            "type": "number"
          }
        ]
      },
      "order": 3,
      "items": [
        "s2-calculus",
        "s2-curve-sketching",
        "s2-complex-numbers",
        "s2-equations-inequalities",
        "s2-matrices",
        "s2-mechanics",
        "s2-misc-pure",
        "s2-statistics",
        "s2-trigonometry",
        "s2-vectors"
      ]
    },
    {
      "id": "C",
      "name": "STEP 3",
      "do": "11 modules in order.",
      "pace": {
        "text": "1 module/week",
        "perWeek": 1,
        "unit": "module"
      },
      "gate": {
        "text": "Same bar on a timed past STEP 3 paper: 4 of 6 answered questions at 14/20 or more.",
        "xp": 200,
        "evidence": [
          {
            "key": "paper",
            "label": "Paper (year)",
            "type": "text"
          },
          {
            "key": "minutes",
            "label": "Time taken (minutes, 180 max)",
            "type": "number"
          },
          {
            "key": "marks",
            "label": "Marks for the 6 answered questions, out of 20 each",
            "type": "text"
          },
          {
            "key": "atLeast14",
            "label": "Questions at 14/20 or more (need 4)",
            "type": "number"
          }
        ]
      },
      "order": 4,
      "items": [
        "s3-algebra",
        "s3-calculus",
        "s3-complex-numbers",
        "s3-coordinate-geometry",
        "s3-differential-equations",
        "s3-hyperbolic-functions",
        "s3-matrices",
        "s3-mechanics",
        "s3-statistics",
        "s3-vectors",
        "s3-mixed-pure"
      ]
    },
    {
      "id": "D",
      "name": "Exam practice",
      "do": "Full past papers, 3 hours, timed.",
      "pace": {
        "text": "1 paper/week",
        "perWeek": 1,
        "unit": "paper"
      },
      "resources": [
        "step-questions",
        "worked-step-papers"
      ],
      "gate": {
        "text": "Stable scores; error log trending down.",
        "xp": 200,
        "evidence": [
          {
            "key": "lastScores",
            "label": "Last 3 paper totals, out of 120",
            "type": "text"
          },
          {
            "key": "errorTrend",
            "label": "Error log trend over 4 weeks (down / flat / up)",
            "type": "text"
          }
        ]
      },
      "order": 5,
      "items": []
    }
  ],
  "blocks": [
    {
      "id": "1",
      "name": "Algebra & graphs",
      "undergroundBlock": "1",
      "assignments": [
        1,
        2,
        3,
        4
      ],
      "items": [
        "found-01",
        "found-02",
        "found-03",
        "found-04"
      ]
    },
    {
      "id": "2",
      "name": "Trig, counting, probability",
      "undergroundBlock": "2",
      "assignments": [
        5,
        6,
        7,
        8
      ],
      "items": [
        "found-05",
        "found-06",
        "found-07",
        "found-08"
      ]
    },
    {
      "id": "3",
      "name": "Proof & functions",
      "undergroundBlock": "3",
      "assignments": [
        9,
        10,
        11,
        12
      ],
      "items": [
        "found-09",
        "found-10",
        "found-11",
        "found-12"
      ]
    },
    {
      "id": "4",
      "name": "Sequences & number",
      "undergroundBlock": "4",
      "assignments": [
        13,
        14,
        15,
        16,
        17
      ],
      "items": [
        "found-13",
        "found-14",
        "found-15",
        "found-16",
        "found-17"
      ]
    },
    {
      "id": "5",
      "name": "Toward calculus",
      "undergroundBlock": "5",
      "assignments": [
        18,
        19,
        20,
        21
      ],
      "items": [
        "found-18",
        "found-19",
        "found-20",
        "found-21"
      ]
    },
    {
      "id": "6",
      "name": "Calculus",
      "undergroundBlock": "6",
      "assignments": [
        22,
        23,
        24,
        25
      ],
      "items": [
        "found-22",
        "found-23",